{
  "$schema": "https://json-schema.org/draft/2020-12/schema",
  "$id": "fused_objects.schema.json",
  "title": "One frame of fused objects",
  "type": "object",
  "required": ["schema_version", "generation_id", "frame_id", "objects", "candidate_outcomes", "diagnostics_ref"],
  "properties": {
    "schema_version": {"const": 3},
    "artifact_type": {"const": "frame_fused_objects"},
    "generation_id": {"type": "string", "format": "uuid"},
    "coordinate_frame": {"type": "string"},
    "units": {"type": "object"},
    "frame_id": {"type": "string"}, "frame_index": {},
    "summary": {"type": "object"},
    "objects": {"type": "array", "items": {"type": "object", "required": ["id", "observations"]}},
    "candidate_outcomes": {"type": "array", "items": {
      "type": "object",
      "required": ["camera", "candidate_id", "status"]
    }},
    "diagnostics_ref": {"type": "string"}
  }
}
